{
  "$schema": "../schema/airport.schema.json",
  "schema_version": 1,
  "airport": {
    "icao": "EKBI",
    "name": "Billund",
    "country": "Denmark",
    "latitude": 55.74158440653346,
    "longitude": 9.144768698071633
  },
  "data_status": "unreviewed",
  "reviewed_at": null,
  "sources": [
    {
      "id": "vatsca-import",
      "kind": "import",
      "url": "https://github.com/Vatsim-Scandinavia/stands/blob/00fcf662237782e5ac300b14710f555730c3fbe0/public/data/ekbi.json",
      "reference": "VATSIM Scandinavia stands, public/data/ekbi.json, commit 00fcf662237782e5ac300b14710f555730c3fbe0",
      "effective_date": null,
      "accessed_at": "2026-10-26"
    }
  ],
  "stands": [
    {
      "id": "0",
      "latitude": 55.73725,
      "longitude": 9.13518333,
      "max_wingspan_m": 28,
      "aircraft_code": null,
      "approved_aircraft": null,
      "prohibited_aircraft": null,
      "source_ids": [
        "vatsca-import"
      ]
    },
    {
      "id": "1",
      "latitude": 55.73726667,
      "longitude": 9.13441111,
      "max_wingspan_m": 28,
      "aircraft_code": null,
      "approved_aircraft": null,
      "prohibited_aircraft": null,
      "source_ids": [
        "vatsca-import"
      ]
    },
    {
      "id": "2",
      "latitude": 55.73740556,
      "longitude": 9.13584167,
      "max_wingspan_m": 28,
      "aircraft_code": null,
      "approved_aircraft": null,
      "prohibited_aircraft": null,
      "source_ids": [
        "vatsca-import"
      ]
    },
    {
      "id": "3",
      "latitude": 55.737425,
      "longitude": 9.13655556,
      "max_wingspan_m": 40,
      "aircraft_code": null,
      "approved_aircraft": null,
      "prohibited_aircraft": null,
      "source_ids": [
        "vatsca-import"
      ]
    },
    {
      "id": "4",
      "latitude": 55.73744722,
      "longitude": 9.13718889,
      "max_wingspan_m": 40,
      "aircraft_code": null,
      "approved_aircraft": null,
      "prohibited_aircraft": null,
      "source_ids": [
        "vatsca-import"
      ]
    },
    {
      "id": "5",
      "latitude": 55.73749167,
      "longitude": 9.13853889,
      "max_wingspan_m": null,
      "aircraft_code": null,
      "approved_aircraft": null,
      "prohibited_aircraft": null,
      "source_ids": [
        "vatsca-import"
      ]
    },
    {
      "id": "6",
      "latitude": 55.73753889,
      "longitude": 9.139975,
      "max_wingspan_m": null,
      "aircraft_code": null,
      "approved_aircraft": null,
      "prohibited_aircraft": null,
      "source_ids": [
        "vatsca-import"
      ]
    },
    {
      "id": "7",
      "latitude": 55.73749167,
      "longitude": 9.1409,
      "max_wingspan_m": null,
      "aircraft_code": null,
      "approved_aircraft": null,
      "prohibited_aircraft": null,
      "source_ids": [
        "vatsca-import"
      ]
    },
    {
      "id": "25",
      "latitude": 55.74522222,
      "longitude": 9.14410278,
      "max_wingspan_m": 44,
      "aircraft_code": null,
      "approved_aircraft": null,
      "prohibited_aircraft": null,
      "source_ids": [
        "vatsca-import"
      ]
    },
    {
      "id": "26",
      "latitude": 55.74524444,
      "longitude": 9.14477222,
      "max_wingspan_m": 44,
      "aircraft_code": null,
      "approved_aircraft": null,
      "prohibited_aircraft": null,
      "source_ids": [
        "vatsca-import"
      ]
    },
    {
      "id": "28",
      "latitude": 55.74526389,
      "longitude": 9.14543889,
      "max_wingspan_m": 44,
      "aircraft_code": null,
      "approved_aircraft": null,
      "prohibited_aircraft": null,
      "source_ids": [
        "vatsca-import"
      ]
    },
    {
      "id": "29",
      "latitude": 55.74528611,
      "longitude": 9.14610556,
      "max_wingspan_m": 44,
      "aircraft_code": null,
      "approved_aircraft": null,
      "prohibited_aircraft": null,
      "source_ids": [
        "vatsca-import"
      ]
    },
    {
      "id": "31",
      "latitude": 55.74530556,
      "longitude": 9.146775,
      "max_wingspan_m": 44,
      "aircraft_code": null,
      "approved_aircraft": null,
      "prohibited_aircraft": null,
      "source_ids": [
        "vatsca-import"
      ]
    },
    {
      "id": "32",
      "latitude": 55.74532778,
      "longitude": 9.14744167,
      "max_wingspan_m": 44,
      "aircraft_code": null,
      "approved_aircraft": null,
      "prohibited_aircraft": null,
      "source_ids": [
        "vatsca-import"
      ]
    },
    {
      "id": "34",
      "latitude": 55.74534722,
      "longitude": 9.14811111,
      "max_wingspan_m": 44,
      "aircraft_code": null,
      "approved_aircraft": null,
      "prohibited_aircraft": null,
      "source_ids": [
        "vatsca-import"
      ]
    },
    {
      "id": "35",
      "latitude": 55.74536944,
      "longitude": 9.14877778,
      "max_wingspan_m": 44,
      "aircraft_code": null,
      "approved_aircraft": null,
      "prohibited_aircraft": null,
      "source_ids": [
        "vatsca-import"
      ]
    },
    {
      "id": "37",
      "latitude": 55.74538889,
      "longitude": 9.14944722,
      "max_wingspan_m": 44,
      "aircraft_code": null,
      "approved_aircraft": null,
      "prohibited_aircraft": null,
      "source_ids": [
        "vatsca-import"
      ]
    },
    {
      "id": "38",
      "latitude": 55.74541111,
      "longitude": 9.15011389,
      "max_wingspan_m": 70,
      "aircraft_code": null,
      "approved_aircraft": null,
      "prohibited_aircraft": null,
      "source_ids": [
        "vatsca-import"
      ]
    },
    {
      "id": "40",
      "latitude": 55.74543056,
      "longitude": 9.15078056,
      "max_wingspan_m": 44,
      "aircraft_code": null,
      "approved_aircraft": null,
      "prohibited_aircraft": null,
      "source_ids": [
        "vatsca-import"
      ]
    },
    {
      "id": "65",
      "latitude": 55.74381111,
      "longitude": 9.14586944,
      "max_wingspan_m": 44,
      "aircraft_code": null,
      "approved_aircraft": null,
      "prohibited_aircraft": null,
      "source_ids": [
        "vatsca-import"
      ]
    },
    {
      "id": "66",
      "latitude": 55.74383333,
      "longitude": 9.14653889,
      "max_wingspan_m": 44,
      "aircraft_code": null,
      "approved_aircraft": null,
      "prohibited_aircraft": null,
      "source_ids": [
        "vatsca-import"
      ]
    },
    {
      "id": "67",
      "latitude": 55.74385278,
      "longitude": 9.14720556,
      "max_wingspan_m": 44,
      "aircraft_code": null,
      "approved_aircraft": null,
      "prohibited_aircraft": null,
      "source_ids": [
        "vatsca-import"
      ]
    },
    {
      "id": "68",
      "latitude": 55.743875,
      "longitude": 9.14787222,
      "max_wingspan_m": 44,
      "aircraft_code": null,
      "approved_aircraft": null,
      "prohibited_aircraft": null,
      "source_ids": [
        "vatsca-import"
      ]
    },
    {
      "id": "69",
      "latitude": 55.74389444,
      "longitude": 9.14854167,
      "max_wingspan_m": 44,
      "aircraft_code": null,
      "approved_aircraft": null,
      "prohibited_aircraft": null,
      "source_ids": [
        "vatsca-import"
      ]
    },
    {
      "id": "90",
      "latitude": 55.74324722,
      "longitude": 9.145925,
      "max_wingspan_m": 44,
      "aircraft_code": null,
      "approved_aircraft": null,
      "prohibited_aircraft": null,
      "source_ids": [
        "vatsca-import"
      ]
    },
    {
      "id": "91",
      "latitude": 55.74326667,
      "longitude": 9.14659167,
      "max_wingspan_m": 44,
      "aircraft_code": null,
      "approved_aircraft": null,
      "prohibited_aircraft": null,
      "source_ids": [
        "vatsca-import"
      ]
    },
    {
      "id": "92",
      "latitude": 55.74328889,
      "longitude": 9.14726111,
      "max_wingspan_m": 44,
      "aircraft_code": null,
      "approved_aircraft": null,
      "prohibited_aircraft": null,
      "source_ids": [
        "vatsca-import"
      ]
    },
    {
      "id": "93",
      "latitude": 55.74330833,
      "longitude": 9.14792778,
      "max_wingspan_m": 44,
      "aircraft_code": null,
      "approved_aircraft": null,
      "prohibited_aircraft": null,
      "source_ids": [
        "vatsca-import"
      ]
    },
    {
      "id": "94",
      "latitude": 55.74333056,
      "longitude": 9.14859722,
      "max_wingspan_m": 44,
      "aircraft_code": null,
      "approved_aircraft": null,
      "prohibited_aircraft": null,
      "source_ids": [
        "vatsca-import"
      ]
    }
  ]
}
