{
  "$schema": "../schema/airport.schema.json",
  "schema_version": 1,
  "airport": {
    "icao": "ENVA",
    "name": "Trondheim Værnes",
    "country": "Norway",
    "latitude": 63.45493356476826,
    "longitude": 10.921131932330448
  },
  "data_status": "unreviewed",
  "reviewed_at": null,
  "sources": [
    {
      "id": "vatsca-import",
      "kind": "import",
      "url": "https://github.com/Vatsim-Scandinavia/stands/blob/00fcf662237782e5ac300b14710f555730c3fbe0/public/data/enva.json",
      "reference": "VATSIM Scandinavia stands, public/data/enva.json, commit 00fcf662237782e5ac300b14710f555730c3fbe0",
      "effective_date": null,
      "accessed_at": "2026-10-26"
    }
  ],
  "stands": [
    {
      "id": "22",
      "latitude": 63.45217778,
      "longitude": 10.91273611,
      "max_wingspan_m": null,
      "aircraft_code": "C",
      "approved_aircraft": null,
      "prohibited_aircraft": null,
      "source_ids": [
        "vatsca-import"
      ]
    },
    {
      "id": "23",
      "latitude": 63.45257222,
      "longitude": 10.91273889,
      "max_wingspan_m": null,
      "aircraft_code": "C",
      "approved_aircraft": null,
      "prohibited_aircraft": null,
      "source_ids": [
        "vatsca-import"
      ]
    },
    {
      "id": "24",
      "latitude": 63.45296667,
      "longitude": 10.91274167,
      "max_wingspan_m": null,
      "aircraft_code": "C",
      "approved_aircraft": null,
      "prohibited_aircraft": null,
      "source_ids": [
        "vatsca-import"
      ]
    },
    {
      "id": "25",
      "latitude": 63.45336111,
      "longitude": 10.91274444,
      "max_wingspan_m": null,
      "aircraft_code": "C",
      "approved_aircraft": null,
      "prohibited_aircraft": null,
      "source_ids": [
        "vatsca-import"
      ]
    },
    {
      "id": "26",
      "latitude": 63.45375556,
      "longitude": 10.91275,
      "max_wingspan_m": null,
      "aircraft_code": "C",
      "approved_aircraft": null,
      "prohibited_aircraft": null,
      "source_ids": [
        "vatsca-import"
      ]
    },
    {
      "id": "27",
      "latitude": 63.45415278,
      "longitude": 10.91275278,
      "max_wingspan_m": null,
      "aircraft_code": "C",
      "approved_aircraft": null,
      "prohibited_aircraft": null,
      "source_ids": [
        "vatsca-import"
      ]
    },
    {
      "id": "28",
      "latitude": 63.45454722,
      "longitude": 10.91275556,
      "max_wingspan_m": null,
      "aircraft_code": "C",
      "approved_aircraft": null,
      "prohibited_aircraft": null,
      "source_ids": [
        "vatsca-import"
      ]
    },
    {
      "id": "29",
      "latitude": 63.45494167,
      "longitude": 10.91277222,
      "max_wingspan_m": null,
      "aircraft_code": "C",
      "approved_aircraft": null,
      "prohibited_aircraft": null,
      "source_ids": [
        "vatsca-import"
      ]
    },
    {
      "id": "30",
      "latitude": 63.45488889,
      "longitude": 10.91365,
      "max_wingspan_m": null,
      "aircraft_code": "D",
      "approved_aircraft": null,
      "prohibited_aircraft": null,
      "source_ids": [
        "vatsca-import"
      ]
    },
    {
      "id": "31",
      "latitude": 63.45488611,
      "longitude": 10.91481111,
      "max_wingspan_m": null,
      "aircraft_code": "D",
      "approved_aircraft": null,
      "prohibited_aircraft": null,
      "source_ids": [
        "vatsca-import"
      ]
    },
    {
      "id": "32",
      "latitude": 63.45488333,
      "longitude": 10.91578333,
      "max_wingspan_m": null,
      "aircraft_code": "C",
      "approved_aircraft": null,
      "prohibited_aircraft": null,
      "source_ids": [
        "vatsca-import"
      ]
    },
    {
      "id": "33",
      "latitude": 63.45488333,
      "longitude": 10.91659722,
      "max_wingspan_m": null,
      "aircraft_code": "C",
      "approved_aircraft": null,
      "prohibited_aircraft": null,
      "source_ids": [
        "vatsca-import"
      ]
    },
    {
      "id": "34",
      "latitude": 63.45488333,
      "longitude": 10.91741111,
      "max_wingspan_m": null,
      "aircraft_code": "C",
      "approved_aircraft": null,
      "prohibited_aircraft": null,
      "source_ids": [
        "vatsca-import"
      ]
    },
    {
      "id": "35",
      "latitude": 63.45488333,
      "longitude": 10.91822222,
      "max_wingspan_m": null,
      "aircraft_code": "C",
      "approved_aircraft": null,
      "prohibited_aircraft": null,
      "source_ids": [
        "vatsca-import"
      ]
    },
    {
      "id": "36",
      "latitude": 63.45488056,
      "longitude": 10.91902778,
      "max_wingspan_m": null,
      "aircraft_code": "C",
      "approved_aircraft": null,
      "prohibited_aircraft": null,
      "source_ids": [
        "vatsca-import"
      ]
    },
    {
      "id": "37",
      "latitude": 63.45488056,
      "longitude": 10.91994444,
      "max_wingspan_m": null,
      "aircraft_code": "C",
      "approved_aircraft": null,
      "prohibited_aircraft": null,
      "source_ids": [
        "vatsca-import"
      ]
    },
    {
      "id": "38",
      "latitude": 63.45526111,
      "longitude": 10.92075833,
      "max_wingspan_m": null,
      "aircraft_code": "C",
      "approved_aircraft": null,
      "prohibited_aircraft": null,
      "source_ids": [
        "vatsca-import"
      ]
    },
    {
      "id": "39",
      "latitude": 63.45529167,
      "longitude": 10.92185278,
      "max_wingspan_m": null,
      "aircraft_code": "C",
      "approved_aircraft": null,
      "prohibited_aircraft": null,
      "source_ids": [
        "vatsca-import"
      ]
    },
    {
      "id": "40L",
      "latitude": 63.45505,
      "longitude": 10.92236944,
      "max_wingspan_m": null,
      "aircraft_code": "D",
      "approved_aircraft": null,
      "prohibited_aircraft": null,
      "source_ids": [
        "vatsca-import"
      ]
    },
    {
      "id": "40",
      "latitude": 63.45510556,
      "longitude": 10.92247222,
      "max_wingspan_m": null,
      "aircraft_code": "C",
      "approved_aircraft": null,
      "prohibited_aircraft": null,
      "source_ids": [
        "vatsca-import"
      ]
    },
    {
      "id": "41L",
      "latitude": 63.45441111,
      "longitude": 10.92246389,
      "max_wingspan_m": null,
      "aircraft_code": "E",
      "approved_aircraft": null,
      "prohibited_aircraft": null,
      "source_ids": [
        "vatsca-import"
      ]
    },
    {
      "id": "41",
      "latitude": 63.45469444,
      "longitude": 10.92246667,
      "max_wingspan_m": null,
      "aircraft_code": "C",
      "approved_aircraft": null,
      "prohibited_aircraft": null,
      "source_ids": [
        "vatsca-import"
      ]
    },
    {
      "id": "42",
      "latitude": 63.45425556,
      "longitude": 10.92246111,
      "max_wingspan_m": null,
      "aircraft_code": "C",
      "approved_aircraft": null,
      "prohibited_aircraft": null,
      "source_ids": [
        "vatsca-import"
      ]
    },
    {
      "id": "43",
      "latitude": 63.45384722,
      "longitude": 10.92245556,
      "max_wingspan_m": null,
      "aircraft_code": "C",
      "approved_aircraft": null,
      "prohibited_aircraft": null,
      "source_ids": [
        "vatsca-import"
      ]
    },
    {
      "id": "44",
      "latitude": 63.45344722,
      "longitude": 10.92245,
      "max_wingspan_m": null,
      "aircraft_code": "C",
      "approved_aircraft": null,
      "prohibited_aircraft": null,
      "source_ids": [
        "vatsca-import"
      ]
    },
    {
      "id": "45",
      "latitude": 63.45304167,
      "longitude": 10.92244722,
      "max_wingspan_m": null,
      "aircraft_code": "C",
      "approved_aircraft": null,
      "prohibited_aircraft": null,
      "source_ids": [
        "vatsca-import"
      ]
    }
  ]
}
