{
  "$schema": "../schema/airport.schema.json",
  "schema_version": 1,
  "airport": {
    "icao": "ENBR",
    "name": "Bergen Flesland",
    "country": "Norway",
    "latitude": 60.28909078470454,
    "longitude": 5.227381717245824
  },
  "data_status": "unreviewed",
  "reviewed_at": null,
  "sources": [
    {
      "id": "vatsca-import",
      "kind": "import",
      "url": "https://github.com/Vatsim-Scandinavia/stands/blob/00fcf662237782e5ac300b14710f555730c3fbe0/public/data/enbr.json",
      "reference": "VATSIM Scandinavia stands, public/data/enbr.json, commit 00fcf662237782e5ac300b14710f555730c3fbe0",
      "effective_date": null,
      "accessed_at": "2026-10-26"
    }
  ],
  "stands": [
    {
      "id": "1",
      "latitude": 60.28219167,
      "longitude": 5.22636667,
      "max_wingspan_m": null,
      "aircraft_code": "E",
      "approved_aircraft": null,
      "prohibited_aircraft": null,
      "source_ids": [
        "vatsca-import"
      ]
    },
    {
      "id": "2",
      "latitude": 60.28305833,
      "longitude": 5.22703611,
      "max_wingspan_m": null,
      "aircraft_code": "B",
      "approved_aircraft": null,
      "prohibited_aircraft": null,
      "source_ids": [
        "vatsca-import"
      ]
    },
    {
      "id": "3",
      "latitude": 60.28361667,
      "longitude": 5.22708889,
      "max_wingspan_m": null,
      "aircraft_code": "C",
      "approved_aircraft": null,
      "prohibited_aircraft": null,
      "source_ids": [
        "vatsca-import"
      ]
    },
    {
      "id": "4",
      "latitude": 60.284,
      "longitude": 5.22695278,
      "max_wingspan_m": null,
      "aircraft_code": "C",
      "approved_aircraft": null,
      "prohibited_aircraft": null,
      "source_ids": [
        "vatsca-import"
      ]
    },
    {
      "id": "5",
      "latitude": 60.28445,
      "longitude": 5.226925,
      "max_wingspan_m": null,
      "aircraft_code": "C",
      "approved_aircraft": null,
      "prohibited_aircraft": null,
      "source_ids": [
        "vatsca-import"
      ]
    },
    {
      "id": "6",
      "latitude": 60.28486389,
      "longitude": 5.226975,
      "max_wingspan_m": null,
      "aircraft_code": "C",
      "approved_aircraft": null,
      "prohibited_aircraft": null,
      "source_ids": [
        "vatsca-import"
      ]
    },
    {
      "id": "7",
      "latitude": 60.28528056,
      "longitude": 5.22683333,
      "max_wingspan_m": null,
      "aircraft_code": "C",
      "approved_aircraft": null,
      "prohibited_aircraft": null,
      "source_ids": [
        "vatsca-import"
      ]
    },
    {
      "id": "8",
      "latitude": 60.28568611,
      "longitude": 5.22712222,
      "max_wingspan_m": null,
      "aircraft_code": "C",
      "approved_aircraft": null,
      "prohibited_aircraft": null,
      "source_ids": [
        "vatsca-import"
      ]
    },
    {
      "id": "10",
      "latitude": 60.28619444,
      "longitude": 5.22677778,
      "max_wingspan_m": null,
      "aircraft_code": "E",
      "approved_aircraft": null,
      "prohibited_aircraft": null,
      "source_ids": [
        "vatsca-import"
      ]
    },
    {
      "id": "9",
      "latitude": 60.286,
      "longitude": 5.22645,
      "max_wingspan_m": null,
      "aircraft_code": "C",
      "approved_aircraft": null,
      "prohibited_aircraft": null,
      "source_ids": [
        "vatsca-import"
      ]
    },
    {
      "id": "11",
      "latitude": 60.28632778,
      "longitude": 5.22634167,
      "max_wingspan_m": null,
      "aircraft_code": "C",
      "approved_aircraft": null,
      "prohibited_aircraft": null,
      "source_ids": [
        "vatsca-import"
      ]
    },
    {
      "id": "15",
      "latitude": 60.28620278,
      "longitude": 5.22966667,
      "max_wingspan_m": null,
      "aircraft_code": "C",
      "approved_aircraft": null,
      "prohibited_aircraft": null,
      "source_ids": [
        "vatsca-import"
      ]
    },
    {
      "id": "16",
      "latitude": 60.28660278,
      "longitude": 5.22953611,
      "max_wingspan_m": null,
      "aircraft_code": "C",
      "approved_aircraft": null,
      "prohibited_aircraft": null,
      "source_ids": [
        "vatsca-import"
      ]
    },
    {
      "id": "17",
      "latitude": 60.287,
      "longitude": 5.2294,
      "max_wingspan_m": null,
      "aircraft_code": "C",
      "approved_aircraft": null,
      "prohibited_aircraft": null,
      "source_ids": [
        "vatsca-import"
      ]
    },
    {
      "id": "18",
      "latitude": 60.28739722,
      "longitude": 5.22926667,
      "max_wingspan_m": null,
      "aircraft_code": "C",
      "approved_aircraft": null,
      "prohibited_aircraft": null,
      "source_ids": [
        "vatsca-import"
      ]
    },
    {
      "id": "19",
      "latitude": 60.28779722,
      "longitude": 5.22913333,
      "max_wingspan_m": null,
      "aircraft_code": "C",
      "approved_aircraft": null,
      "prohibited_aircraft": null,
      "source_ids": [
        "vatsca-import"
      ]
    },
    {
      "id": "20",
      "latitude": 60.28819444,
      "longitude": 5.229,
      "max_wingspan_m": null,
      "aircraft_code": "C",
      "approved_aircraft": null,
      "prohibited_aircraft": null,
      "source_ids": [
        "vatsca-import"
      ]
    },
    {
      "id": "23",
      "latitude": 60.28823889,
      "longitude": 5.22694722,
      "max_wingspan_m": null,
      "aircraft_code": "C",
      "approved_aircraft": null,
      "prohibited_aircraft": null,
      "source_ids": [
        "vatsca-import"
      ]
    },
    {
      "id": "24",
      "latitude": 60.28835278,
      "longitude": 5.22629167,
      "max_wingspan_m": null,
      "aircraft_code": "E",
      "approved_aircraft": null,
      "prohibited_aircraft": null,
      "source_ids": [
        "vatsca-import"
      ]
    },
    {
      "id": "25",
      "latitude": 60.28862778,
      "longitude": 5.22586111,
      "max_wingspan_m": null,
      "aircraft_code": "C",
      "approved_aircraft": null,
      "prohibited_aircraft": null,
      "source_ids": [
        "vatsca-import"
      ]
    },
    {
      "id": "26",
      "latitude": 60.288925,
      "longitude": 5.22566944,
      "max_wingspan_m": null,
      "aircraft_code": "C",
      "approved_aircraft": null,
      "prohibited_aircraft": null,
      "source_ids": [
        "vatsca-import"
      ]
    },
    {
      "id": "27",
      "latitude": 60.28923611,
      "longitude": 5.22576111,
      "max_wingspan_m": null,
      "aircraft_code": "E",
      "approved_aircraft": null,
      "prohibited_aircraft": null,
      "source_ids": [
        "vatsca-import"
      ]
    },
    {
      "id": "28",
      "latitude": 60.28951667,
      "longitude": 5.22606111,
      "max_wingspan_m": null,
      "aircraft_code": "C",
      "approved_aircraft": null,
      "prohibited_aircraft": null,
      "source_ids": [
        "vatsca-import"
      ]
    },
    {
      "id": "29",
      "latitude": 60.28970278,
      "longitude": 5.22659167,
      "max_wingspan_m": null,
      "aircraft_code": "C",
      "approved_aircraft": null,
      "prohibited_aircraft": null,
      "source_ids": [
        "vatsca-import"
      ]
    },
    {
      "id": "31",
      "latitude": 60.28978333,
      "longitude": 5.22725,
      "max_wingspan_m": null,
      "aircraft_code": "C",
      "approved_aircraft": null,
      "prohibited_aircraft": null,
      "source_ids": [
        "vatsca-import"
      ]
    },
    {
      "id": "32",
      "latitude": 60.28972222,
      "longitude": 5.22794167,
      "max_wingspan_m": null,
      "aircraft_code": "C",
      "approved_aircraft": null,
      "prohibited_aircraft": null,
      "source_ids": [
        "vatsca-import"
      ]
    },
    {
      "id": "41",
      "latitude": 60.29085,
      "longitude": 5.22888972,
      "max_wingspan_m": null,
      "aircraft_code": "C",
      "approved_aircraft": null,
      "prohibited_aircraft": null,
      "source_ids": [
        "vatsca-import"
      ]
    },
    {
      "id": "42",
      "latitude": 60.2911,
      "longitude": 5.22807806,
      "max_wingspan_m": null,
      "aircraft_code": "C",
      "approved_aircraft": null,
      "prohibited_aircraft": null,
      "source_ids": [
        "vatsca-import"
      ]
    },
    {
      "id": "43",
      "latitude": 60.29102778,
      "longitude": 5.22723694,
      "max_wingspan_m": null,
      "aircraft_code": "C",
      "approved_aircraft": null,
      "prohibited_aircraft": null,
      "source_ids": [
        "vatsca-import"
      ]
    },
    {
      "id": "46",
      "latitude": 60.29100278,
      "longitude": 5.22667278,
      "max_wingspan_m": null,
      "aircraft_code": "C",
      "approved_aircraft": null,
      "prohibited_aircraft": null,
      "source_ids": [
        "vatsca-import"
      ]
    },
    {
      "id": "47",
      "latitude": 60.29092222,
      "longitude": 5.22557556,
      "max_wingspan_m": null,
      "aircraft_code": "C",
      "approved_aircraft": null,
      "prohibited_aircraft": null,
      "source_ids": [
        "vatsca-import"
      ]
    },
    {
      "id": "48",
      "latitude": 60.290875,
      "longitude": 5.2247475,
      "max_wingspan_m": null,
      "aircraft_code": "C",
      "approved_aircraft": null,
      "prohibited_aircraft": null,
      "source_ids": [
        "vatsca-import"
      ]
    }
  ]
}
