{
  "$schema": "../schema/airport.schema.json",
  "schema_version": 1,
  "airport": {
    "icao": "EFTU",
    "name": "Turku",
    "country": "Finland",
    "latitude": 60.512314,
    "longitude": 22.270441
  },
  "data_status": "unreviewed",
  "reviewed_at": null,
  "sources": [
    {
      "id": "vatsca-import",
      "kind": "import",
      "url": "https://github.com/Vatsim-Scandinavia/stands/blob/00fcf662237782e5ac300b14710f555730c3fbe0/public/data/eftu.json",
      "reference": "VATSIM Scandinavia stands, public/data/eftu.json, commit 00fcf662237782e5ac300b14710f555730c3fbe0",
      "effective_date": null,
      "accessed_at": "2026-10-26"
    }
  ],
  "stands": [
    {
      "id": "1",
      "latitude": 60.512968,
      "longitude": 22.275857,
      "max_wingspan_m": null,
      "aircraft_code": "B",
      "approved_aircraft": null,
      "prohibited_aircraft": null,
      "source_ids": [
        "vatsca-import"
      ]
    },
    {
      "id": "2",
      "latitude": 60.512825,
      "longitude": 22.27523,
      "max_wingspan_m": null,
      "aircraft_code": "B",
      "approved_aircraft": null,
      "prohibited_aircraft": null,
      "source_ids": [
        "vatsca-import"
      ]
    },
    {
      "id": "3",
      "latitude": 60.512689,
      "longitude": 22.27432,
      "max_wingspan_m": null,
      "aircraft_code": "C",
      "approved_aircraft": null,
      "prohibited_aircraft": null,
      "source_ids": [
        "vatsca-import"
      ]
    },
    {
      "id": "4,3B",
      "latitude": 60.512201,
      "longitude": 22.274031,
      "max_wingspan_m": null,
      "aircraft_code": "C",
      "approved_aircraft": null,
      "prohibited_aircraft": null,
      "source_ids": [
        "vatsca-import"
      ]
    },
    {
      "id": "5",
      "latitude": 60.511717,
      "longitude": 22.27346,
      "max_wingspan_m": null,
      "aircraft_code": "C",
      "approved_aircraft": null,
      "prohibited_aircraft": null,
      "source_ids": [
        "vatsca-import"
      ]
    },
    {
      "id": "6",
      "latitude": 60.511242,
      "longitude": 22.272914,
      "max_wingspan_m": null,
      "aircraft_code": "C",
      "approved_aircraft": null,
      "prohibited_aircraft": null,
      "source_ids": [
        "vatsca-import"
      ]
    },
    {
      "id": "7",
      "latitude": 60.510748,
      "longitude": 22.272359,
      "max_wingspan_m": null,
      "aircraft_code": "C",
      "approved_aircraft": null,
      "prohibited_aircraft": null,
      "source_ids": [
        "vatsca-import"
      ]
    },
    {
      "id": "8",
      "latitude": 60.512465,
      "longitude": 22.271506,
      "max_wingspan_m": null,
      "aircraft_code": "F",
      "approved_aircraft": null,
      "prohibited_aircraft": null,
      "source_ids": [
        "vatsca-import"
      ]
    },
    {
      "id": "8A",
      "latitude": 60.512617,
      "longitude": 22.267155,
      "max_wingspan_m": null,
      "aircraft_code": "C",
      "approved_aircraft": null,
      "prohibited_aircraft": null,
      "source_ids": [
        "vatsca-import"
      ]
    },
    {
      "id": "9",
      "latitude": 60.512368,
      "longitude": 22.266282,
      "max_wingspan_m": null,
      "aircraft_code": "C",
      "approved_aircraft": null,
      "prohibited_aircraft": null,
      "source_ids": [
        "vatsca-import"
      ]
    },
    {
      "id": "10",
      "latitude": 60.511735,
      "longitude": 22.266162,
      "max_wingspan_m": null,
      "aircraft_code": "C",
      "approved_aircraft": null,
      "prohibited_aircraft": null,
      "source_ids": [
        "vatsca-import"
      ]
    },
    {
      "id": "11",
      "latitude": 60.511107,
      "longitude": 22.266304,
      "max_wingspan_m": null,
      "aircraft_code": "C",
      "approved_aircraft": null,
      "prohibited_aircraft": null,
      "source_ids": [
        "vatsca-import"
      ]
    },
    {
      "id": "12",
      "latitude": 60.511014,
      "longitude": 22.264537,
      "max_wingspan_m": null,
      "aircraft_code": "C",
      "approved_aircraft": null,
      "prohibited_aircraft": null,
      "source_ids": [
        "vatsca-import"
      ]
    },
    {
      "id": "FIH20",
      "latitude": 60.512479,
      "longitude": 22.279843,
      "max_wingspan_m": null,
      "aircraft_code": "B",
      "approved_aircraft": null,
      "prohibited_aircraft": null,
      "source_ids": [
        "vatsca-import"
      ]
    }
  ]
}
