{
  "$schema": "../schema/airport.schema.json",
  "schema_version": 1,
  "airport": {
    "icao": "ENTO",
    "name": "Sandefjord Torp",
    "country": "Norway",
    "latitude": 59.181338968528145,
    "longitude": 10.258435540518166
  },
  "data_status": "unreviewed",
  "reviewed_at": null,
  "sources": [
    {
      "id": "vatsca-import",
      "kind": "import",
      "url": "https://github.com/Vatsim-Scandinavia/stands/blob/00fcf662237782e5ac300b14710f555730c3fbe0/public/data/ento.json",
      "reference": "VATSIM Scandinavia stands, public/data/ento.json, commit 00fcf662237782e5ac300b14710f555730c3fbe0",
      "effective_date": null,
      "accessed_at": "2026-10-26"
    }
  ],
  "stands": [
    {
      "id": "1",
      "latitude": 59.179913888889,
      "longitude": 10.253894444444,
      "max_wingspan_m": null,
      "aircraft_code": "D",
      "approved_aircraft": null,
      "prohibited_aircraft": null,
      "source_ids": [
        "vatsca-import"
      ]
    },
    {
      "id": "2",
      "latitude": 59.179608333333,
      "longitude": 10.253986111111,
      "max_wingspan_m": null,
      "aircraft_code": "C",
      "approved_aircraft": null,
      "prohibited_aircraft": null,
      "source_ids": [
        "vatsca-import"
      ]
    },
    {
      "id": "3",
      "latitude": 59.179244444444,
      "longitude": 10.253991666667,
      "max_wingspan_m": null,
      "aircraft_code": "C",
      "approved_aircraft": null,
      "prohibited_aircraft": null,
      "source_ids": [
        "vatsca-import"
      ]
    },
    {
      "id": "4",
      "latitude": 59.178880555556,
      "longitude": 10.253997222222,
      "max_wingspan_m": null,
      "aircraft_code": "C",
      "approved_aircraft": null,
      "prohibited_aircraft": null,
      "source_ids": [
        "vatsca-import"
      ]
    },
    {
      "id": "5",
      "latitude": 59.178516666667,
      "longitude": 10.253997222222,
      "max_wingspan_m": null,
      "aircraft_code": "C",
      "approved_aircraft": null,
      "prohibited_aircraft": null,
      "source_ids": [
        "vatsca-import"
      ]
    },
    {
      "id": "10",
      "latitude": 59.179986111111,
      "longitude": 10.253269444444,
      "max_wingspan_m": null,
      "aircraft_code": "C",
      "approved_aircraft": null,
      "prohibited_aircraft": null,
      "source_ids": [
        "vatsca-import"
      ]
    },
    {
      "id": "11",
      "latitude": 59.179986111111,
      "longitude": 10.252561111111,
      "max_wingspan_m": null,
      "aircraft_code": "C",
      "approved_aircraft": null,
      "prohibited_aircraft": null,
      "source_ids": [
        "vatsca-import"
      ]
    },
    {
      "id": "12",
      "latitude": 59.179983333333,
      "longitude": 10.251852777778,
      "max_wingspan_m": null,
      "aircraft_code": "C",
      "approved_aircraft": null,
      "prohibited_aircraft": null,
      "source_ids": [
        "vatsca-import"
      ]
    },
    {
      "id": "13",
      "latitude": 59.179980555556,
      "longitude": 10.251147222222,
      "max_wingspan_m": null,
      "aircraft_code": "C",
      "approved_aircraft": null,
      "prohibited_aircraft": null,
      "source_ids": [
        "vatsca-import"
      ]
    },
    {
      "id": "14",
      "latitude": 59.180008333333,
      "longitude": 10.250441666667,
      "max_wingspan_m": null,
      "aircraft_code": "C",
      "approved_aircraft": null,
      "prohibited_aircraft": null,
      "source_ids": [
        "vatsca-import"
      ]
    },
    {
      "id": "15",
      "latitude": 59.180005555556,
      "longitude": 10.249733333333,
      "max_wingspan_m": null,
      "aircraft_code": "C",
      "approved_aircraft": null,
      "prohibited_aircraft": null,
      "source_ids": [
        "vatsca-import"
      ]
    },
    {
      "id": "32",
      "latitude": 59.185705555556,
      "longitude": 10.256238888889,
      "max_wingspan_m": null,
      "aircraft_code": "B",
      "approved_aircraft": null,
      "prohibited_aircraft": null,
      "source_ids": [
        "vatsca-import"
      ]
    },
    {
      "id": "33",
      "latitude": 59.185947222222,
      "longitude": 10.256238888889,
      "max_wingspan_m": null,
      "aircraft_code": "B",
      "approved_aircraft": null,
      "prohibited_aircraft": null,
      "source_ids": [
        "vatsca-import"
      ]
    },
    {
      "id": "34",
      "latitude": 59.186188888889,
      "longitude": 10.256238888889,
      "max_wingspan_m": null,
      "aircraft_code": "B",
      "approved_aircraft": null,
      "prohibited_aircraft": null,
      "source_ids": [
        "vatsca-import"
      ]
    }
  ]
}
