{
  "$schema": "../schema/airport.schema.json",
  "schema_version": 1,
  "airport": {
    "icao": "ESPA",
    "name": "Luleå",
    "country": "Sweden",
    "latitude": 65.54850757437967,
    "longitude": 22.12282867024561
  },
  "data_status": "unreviewed",
  "reviewed_at": null,
  "sources": [
    {
      "id": "vatsca-import",
      "kind": "import",
      "url": "https://github.com/Vatsim-Scandinavia/stands/blob/00fcf662237782e5ac300b14710f555730c3fbe0/public/data/espa.json",
      "reference": "VATSIM Scandinavia stands, public/data/espa.json, commit 00fcf662237782e5ac300b14710f555730c3fbe0",
      "effective_date": null,
      "accessed_at": "2026-10-26"
    }
  ],
  "stands": [
    {
      "id": "3",
      "latitude": 65.54894444,
      "longitude": 22.12133333,
      "max_wingspan_m": null,
      "aircraft_code": "D",
      "approved_aircraft": null,
      "prohibited_aircraft": null,
      "source_ids": [
        "vatsca-import"
      ]
    },
    {
      "id": "4",
      "latitude": 65.54861111,
      "longitude": 22.12211111,
      "max_wingspan_m": null,
      "aircraft_code": "D",
      "approved_aircraft": null,
      "prohibited_aircraft": null,
      "source_ids": [
        "vatsca-import"
      ]
    },
    {
      "id": "5",
      "latitude": 65.54827778,
      "longitude": 22.12294444,
      "max_wingspan_m": null,
      "aircraft_code": "E",
      "approved_aircraft": null,
      "prohibited_aircraft": null,
      "source_ids": [
        "vatsca-import"
      ]
    },
    {
      "id": "6",
      "latitude": 65.54815889,
      "longitude": 22.12391222,
      "max_wingspan_m": null,
      "aircraft_code": "C",
      "approved_aircraft": null,
      "prohibited_aircraft": null,
      "source_ids": [
        "vatsca-import"
      ]
    },
    {
      "id": "7",
      "latitude": 65.54789167,
      "longitude": 22.12450056,
      "max_wingspan_m": null,
      "aircraft_code": "C",
      "approved_aircraft": null,
      "prohibited_aircraft": null,
      "source_ids": [
        "vatsca-import"
      ]
    },
    {
      "id": "20",
      "latitude": 65.54946639,
      "longitude": 22.12017389,
      "max_wingspan_m": null,
      "aircraft_code": "C",
      "approved_aircraft": null,
      "prohibited_aircraft": null,
      "source_ids": [
        "vatsca-import"
      ]
    },
    {
      "id": "21",
      "latitude": 65.54967194,
      "longitude": 22.12077528,
      "max_wingspan_m": null,
      "aircraft_code": "B",
      "approved_aircraft": null,
      "prohibited_aircraft": null,
      "source_ids": [
        "vatsca-import"
      ]
    },
    {
      "id": "22",
      "latitude": 65.54936111,
      "longitude": 22.12105556,
      "max_wingspan_m": null,
      "aircraft_code": "C",
      "approved_aircraft": null,
      "prohibited_aircraft": null,
      "source_ids": [
        "vatsca-import"
      ]
    }
  ]
}
