{
  "$schema": "../schema/airport.schema.json",
  "schema_version": 1,
  "airport": {
    "icao": "EKYT",
    "name": "Aalborg",
    "country": "Denmark",
    "latitude": 57.08623368349069,
    "longitude": 9.870397001678205
  },
  "data_status": "unreviewed",
  "reviewed_at": null,
  "sources": [
    {
      "id": "vatsca-import",
      "kind": "import",
      "url": "https://github.com/Vatsim-Scandinavia/stands/blob/00fcf662237782e5ac300b14710f555730c3fbe0/public/data/ekyt.json",
      "reference": "VATSIM Scandinavia stands, public/data/ekyt.json, commit 00fcf662237782e5ac300b14710f555730c3fbe0",
      "effective_date": null,
      "accessed_at": "2026-10-26"
    }
  ],
  "stands": [
    {
      "id": "1",
      "latitude": 57.08538889,
      "longitude": 9.87224444,
      "max_wingspan_m": 30,
      "aircraft_code": null,
      "approved_aircraft": null,
      "prohibited_aircraft": null,
      "source_ids": [
        "vatsca-import"
      ]
    },
    {
      "id": "2",
      "latitude": 57.08570833,
      "longitude": 9.87171389,
      "max_wingspan_m": 30,
      "aircraft_code": null,
      "approved_aircraft": null,
      "prohibited_aircraft": null,
      "source_ids": [
        "vatsca-import"
      ]
    },
    {
      "id": "3",
      "latitude": 57.08615278,
      "longitude": 9.87119722,
      "max_wingspan_m": 30,
      "aircraft_code": null,
      "approved_aircraft": null,
      "prohibited_aircraft": null,
      "source_ids": [
        "vatsca-import"
      ]
    },
    {
      "id": "4",
      "latitude": 57.08651389,
      "longitude": 9.87060278,
      "max_wingspan_m": 40,
      "aircraft_code": null,
      "approved_aircraft": null,
      "prohibited_aircraft": null,
      "source_ids": [
        "vatsca-import"
      ]
    },
    {
      "id": "5",
      "latitude": 57.08686389,
      "longitude": 9.86994167,
      "max_wingspan_m": 40,
      "aircraft_code": null,
      "approved_aircraft": null,
      "prohibited_aircraft": null,
      "source_ids": [
        "vatsca-import"
      ]
    },
    {
      "id": "6",
      "latitude": 57.08698611,
      "longitude": 9.86961944,
      "max_wingspan_m": 40,
      "aircraft_code": null,
      "approved_aircraft": null,
      "prohibited_aircraft": null,
      "source_ids": [
        "vatsca-import"
      ]
    },
    {
      "id": "7",
      "latitude": 57.08729722,
      "longitude": 9.869225,
      "max_wingspan_m": 40,
      "aircraft_code": null,
      "approved_aircraft": null,
      "prohibited_aircraft": null,
      "source_ids": [
        "vatsca-import"
      ]
    },
    {
      "id": "8",
      "latitude": 57.08760833,
      "longitude": 9.86883333,
      "max_wingspan_m": 40,
      "aircraft_code": null,
      "approved_aircraft": null,
      "prohibited_aircraft": null,
      "source_ids": [
        "vatsca-import"
      ]
    },
    {
      "id": "10",
      "latitude": 57.08533333,
      "longitude": 9.86996667,
      "max_wingspan_m": null,
      "aircraft_code": "E",
      "approved_aircraft": null,
      "prohibited_aircraft": null,
      "source_ids": [
        "vatsca-import"
      ]
    }
  ]
}
